{"schema_version":"hermes.domain-fixture-overlay.v1","fixture_id":"xingce.common-sense.scientific-method.offline-01","extends":"common_sense_scientific_method.json","domain":"xingce","path":"common_political_knowledge","mode":"offline","scenario_response":"D","execution":{"connectivity":"offline","cloud_calls_expected":0,"provider_invoked":false,"fallback":"deterministic_local","scorer":"deterministic_local"},"expected_semantics":{"score":"deterministic_local","cause_status":"unconfirmed_hypothesis","agent_action":"local_probe_then_defer_generative_feedback"}}
