{"schema_version":"hermes.domain-fixture-overlay.v1","fixture_id":"shenlun.official-writing.water-notice.ambiguous-01","extends":"official_notice_water.json","domain":"shenlun","path":"official_writing","mode":"ambiguous","scenario_response":"明天社区会停水，请大家注意。","execution":{"connectivity":"local","cloud_calls_expected":0,"fallback":"not_needed","scorer":"deterministic_local"},"expected_semantics":{"score":"fail","cause_status":"unconfirmed_hypothesis","minimum_candidates":2,"agent_action":"request_discriminating_probe"}}
