{"schema_version":"hermes.domain-fixture-overlay.v1","fixture_id":"xingce.quantity.work-rate.ambiguous-01","extends":"quantity_work_rate.json","domain":"xingce","path":"quantitative","mode":"ambiguous","scenario_response":"D","execution":{"connectivity":"local","cloud_calls_expected":0,"fallback":"not_needed","scorer":"deterministic_local"},"expected_semantics":{"score":"fail","cause_status":"unconfirmed_hypothesis","minimum_candidates":2,"agent_action":"request_discriminating_probe"}}
