{"schema_version":"hermes.domain-fixture-overlay.v1","fixture_id":"interview.emergency.power-outage.offline-01","extends":"emergency_power_outage.json","domain":"interview","path":"emergency","mode":"offline","scenario_response":"先疏导人流保障安全，再联系电力维修。","execution":{"connectivity":"offline","cloud_calls_expected":0,"provider_invoked":false,"fallback":"deterministic_local","scorer":"deterministic_local"},"expected_semantics":{"score":"deterministic_local","cause_status":"unconfirmed_hypothesis","agent_action":"local_probe_then_defer_generative_feedback"}}
