{"schema_version":"hermes.domain-fixture-overlay.v1","fixture_id":"interview.comprehensive.ai-service.ambiguous-01","extends":"comprehensive_ai_service.json","domain":"interview","path":"comprehensive_analysis","mode":"ambiguous","scenario_response":"AI代表未来，应该全面使用，这样办事就方便了。","execution":{"connectivity":"local","cloud_calls_expected":0,"fallback":"not_needed","scorer":"deterministic_local"},"expected_semantics":{"score":"fail","cause_status":"unconfirmed_hypothesis","minimum_candidates":2,"agent_action":"request_discriminating_probe"}}
