{"schema_version":"hermes.domain-fixture-overlay.v1","fixture_id":"shenlun.official-writing.water-notice.offline-01","extends":"official_notice_water.json","domain":"shenlun","path":"official_writing","mode":"offline","scenario_response":"通知：7月15日清洗水箱，请提前储水。","execution":{"connectivity":"offline","cloud_calls_expected":0,"provider_invoked":false,"fallback":"deterministic_local","scorer":"deterministic_local"},"expected_semantics":{"score":"deterministic_local","cause_status":"unconfirmed_hypothesis","agent_action":"local_probe_then_defer_generative_feedback"}}
