{"schema_version":"hermes.domain-fixture-overlay.v1","fixture_id":"xingce.judgment.necessary-condition.ambiguous-01","extends":"judgment_necessary_condition.json","domain":"xingce","path":"judgment","mode":"ambiguous","scenario_response":"B","execution":{"connectivity":"local","cloud_calls_expected":0,"fallback":"not_needed","scorer":"deterministic_local"},"expected_semantics":{"score":"fail","cause_status":"unconfirmed_hypothesis","minimum_candidates":2,"agent_action":"request_discriminating_probe"}}
