{"schema_version":"hermes.domain-fixture-overlay.v1","fixture_id":"interview.organization.reading-day.offline-01","extends":"organization_reading_day.json","domain":"interview","path":"organization","mode":"offline","scenario_response":"先确定场地和流程，活动结束后收集反馈。","execution":{"connectivity":"offline","cloud_calls_expected":0,"provider_invoked":false,"fallback":"deterministic_local","scorer":"deterministic_local"},"expected_semantics":{"score":"deterministic_local","cause_status":"unconfirmed_hypothesis","agent_action":"local_probe_then_defer_generative_feedback"}}
