{"schema_version":"hermes.domain-fixture-overlay.v1","fixture_id":"interview.interpersonal.credit-conflict.offline-01","extends":"interpersonal_credit_conflict.json","domain":"interview","path":"interpersonal","mode":"offline","scenario_response":"我会保持冷静，先核对事实再处理。","execution":{"connectivity":"offline","cloud_calls_expected":0,"provider_invoked":false,"fallback":"deterministic_local","scorer":"deterministic_local"},"expected_semantics":{"score":"deterministic_local","cause_status":"unconfirmed_hypothesis","agent_action":"local_probe_then_defer_generative_feedback"}}
