{"schema_version":"hermes.domain-fixture-overlay.v1","fixture_id":"shenlun.analysis.night-market.offline-01","extends":"analysis_night_market.json","domain":"shenlun","path":"comprehensive_analysis","mode":"offline","scenario_response":"夜市有噪声和垃圾，需要治理。","execution":{"connectivity":"offline","cloud_calls_expected":0,"provider_invoked":false,"fallback":"deterministic_local","scorer":"deterministic_local"},"expected_semantics":{"score":"deterministic_local","cause_status":"unconfirmed_hypothesis","agent_action":"local_probe_then_defer_generative_feedback"}}
