{"schema_version":"hermes.domain-fixture-overlay.v1","fixture_id":"shenlun.analysis.night-market.ambiguous-01","extends":"analysis_night_market.json","domain":"shenlun","path":"comprehensive_analysis","mode":"ambiguous","scenario_response":"夜市很热闹，能够增加收入，所以这句话完全正确。","execution":{"connectivity":"local","cloud_calls_expected":0,"fallback":"not_needed","scorer":"deterministic_local"},"expected_semantics":{"score":"fail","cause_status":"unconfirmed_hypothesis","minimum_candidates":2,"agent_action":"request_discriminating_probe"}}
