{"schema_version":"hermes.domain-fixture-overlay.v1","fixture_id":"shenlun.countermeasure.rural-bus.ambiguous-01","extends":"countermeasure_rural_bus.json","domain":"shenlun","path":"recommendation","mode":"ambiguous","scenario_response":"加强宣传和管理，开发更好的线上小程序。","execution":{"connectivity":"local","cloud_calls_expected":0,"fallback":"not_needed","scorer":"deterministic_local"},"expected_semantics":{"score":"fail","cause_status":"unconfirmed_hypothesis","minimum_candidates":2,"agent_action":"request_discriminating_probe"}}
