{"schema_version":"hermes.domain-fixture-overlay.v1","fixture_id":"interview.comprehensive.ai-service.offline-01","extends":"comprehensive_ai_service.json","domain":"interview","path":"comprehensive_analysis","mode":"offline","scenario_response":"AI能提高效率，但复杂事项可能误判。","execution":{"connectivity":"offline","cloud_calls_expected":0,"provider_invoked":false,"fallback":"deterministic_local","scorer":"deterministic_local"},"expected_semantics":{"score":"deterministic_local","cause_status":"unconfirmed_hypothesis","agent_action":"local_probe_then_defer_generative_feedback"}}
