{"schema_version":"hermes.domain-fixture-overlay.v1","fixture_id":"xingce.verbal.main-idea.ambiguous-01","extends":"verbal_main_idea.json","domain":"xingce","path":"verbal","mode":"ambiguous","scenario_response":"A","execution":{"connectivity":"local","cloud_calls_expected":0,"fallback":"not_needed","scorer":"deterministic_local"},"expected_semantics":{"score":"fail","cause_status":"unconfirmed_hypothesis","minimum_candidates":2,"agent_action":"request_discriminating_probe"}}
