{"schema_version":"hermes.domain-fixture-overlay.v1","fixture_id":"xingce.common-sense.scientific-method.ambiguous-01","extends":"common_sense_scientific_method.json","domain":"xingce","path":"common_political_knowledge","mode":"ambiguous","scenario_response":"C","execution":{"connectivity":"local","cloud_calls_expected":0,"fallback":"not_needed","scorer":"deterministic_local"},"expected_semantics":{"score":"fail","cause_status":"unconfirmed_hypothesis","minimum_candidates":2,"agent_action":"request_discriminating_probe"}}
