{"schema_version":"hermes.domain-fixture-overlay.v1","fixture_id":"shenlun.essay.digital-inclusion.offline-01","extends":"essay_digital_inclusion.json","domain":"shenlun","path":"essay","mode":"offline","scenario_response":"技术进步也要兼顾公平，但具体如何做还要研究。","execution":{"connectivity":"offline","cloud_calls_expected":0,"provider_invoked":false,"fallback":"deterministic_local","scorer":"deterministic_local"},"expected_semantics":{"score":"deterministic_local","cause_status":"unconfirmed_hypothesis","agent_action":"local_probe_then_defer_generative_feedback"}}
