{"schema_version":"hermes.domain-fixture-overlay.v1","fixture_id":"interview.organization.reading-day.ambiguous-01","extends":"organization_reading_day.json","domain":"interview","path":"organization","mode":"ambiguous","scenario_response":"首先制定方案，然后做好宣传，活动当天维持秩序，最后总结经验。","execution":{"connectivity":"local","cloud_calls_expected":0,"fallback":"not_needed","scorer":"deterministic_local"},"expected_semantics":{"score":"fail","cause_status":"unconfirmed_hypothesis","minimum_candidates":2,"agent_action":"request_discriminating_probe"}}
