{"schema_version":"hermes.domain-fixture-overlay.v1","fixture_id":"xingce.quantity.work-rate.offline-01","extends":"quantity_work_rate.json","domain":"xingce","path":"quantitative","mode":"offline","scenario_response":"C","execution":{"connectivity":"offline","cloud_calls_expected":0,"provider_invoked":false,"fallback":"deterministic_local","scorer":"deterministic_local"},"expected_semantics":{"score":"deterministic_local","cause_status":"unconfirmed_hypothesis","agent_action":"local_probe_then_defer_generative_feedback"}}
