{"schema_version":"hermes.domain-fixture-overlay.v1","fixture_id":"interview.interpersonal.credit-conflict.ambiguous-01","extends":"interpersonal_credit_conflict.json","domain":"interview","path":"interpersonal","mode":"ambiguous","scenario_response":"我会立刻在会上指出他的问题，并向领导投诉。","execution":{"connectivity":"local","cloud_calls_expected":0,"fallback":"not_needed","scorer":"deterministic_local"},"expected_semantics":{"score":"fail","cause_status":"unconfirmed_hypothesis","minimum_candidates":2,"agent_action":"request_discriminating_probe"}}
