{"schema_version":"hermes.domain-fixture-overlay.v1","fixture_id":"shenlun.essay.digital-inclusion.ambiguous-01","extends":"essay_digital_inclusion.json","domain":"shenlun","path":"essay","mode":"ambiguous","scenario_response":"技术发展很重要，线下服务也很重要，我们要高度重视并积极推进。","execution":{"connectivity":"local","cloud_calls_expected":0,"fallback":"not_needed","scorer":"deterministic_local"},"expected_semantics":{"score":"fail","cause_status":"unconfirmed_hypothesis","minimum_candidates":2,"agent_action":"request_discriminating_probe"}}
